{
  "version": "0.3.0-candidate.1",
  "status": "candidate",
  "sourceCommit": "d4efef99badf75844354cdd73e289ec233a1cd1a",
  "manifestSha256": "b2027382096ad40a6ce8849936a845906c760934f888f860044da0d6193e3738",
  "standards": [
    "standards/agent-native.md",
    "standards/architecture.md",
    "standards/auth-security.md",
    "standards/authentication.md",
    "standards/data-lifecycle.md",
    "standards/data.md",
    "standards/media.md",
    "standards/preferred-stack.md",
    "standards/repository-lifecycle.md",
    "standards/reusable-modules.md",
    "standards/secrets.md",
    "standards/security.md",
    "standards/vendor-integration.md",
    "standards/workos-evidence.md"
  ],
  "createdAt": "2026-08-05T08:00:00.000Z",
  "visibility": "private",
  "signedBy": "local-candidate-b2027382096ad40a",
  "minimumKitVersion": "0.1.0"
}
